{
  "graph_id": "graph_example_low_risk",
  "schema_version": "0.9.2",
  "intent_id": "intent_example_low_risk",
  "created_at": "2026-01-25T10:05:00Z",
  "nodes": [
    {
      "node_id": "node_phase_001",
      "node_type": "phase",
      "label": "Analysis Phase",
      "description": "Scan utility modules to identify undocumented functions",
      "phase_ref": "analysis"
    },
    {
      "node_id": "node_action_001",
      "node_type": "action_proposal",
      "label": "Scan Python Files",
      "description": "Scan agentos/utils/ module for public functions",
      "command_ref": "scan_python_files",
      "effects": ["read"],
      "risk_level": "low",
      "evidence_refs": [
        "scan://python_modules/agentos.utils"
      ]
    },
    {
      "node_id": "node_phase_002",
      "node_type": "phase",
      "label": "Implementation Phase",
      "description": "Add docstrings to identified functions",
      "phase_ref": "implementation"
    },
    {
      "node_id": "node_action_002",
      "node_type": "action_proposal",
      "label": "Add Docstrings",
      "description": "Add Google-style docstrings to format.py and validation.py",
      "command_ref": "modify_python_file",
      "effects": ["write"],
      "risk_level": "low",
      "evidence_refs": [
        "scan://file/agentos/utils/format.py",
        "scan://file/agentos/utils/validation.py"
      ]
    },
    {
      "node_id": "node_phase_003",
      "node_type": "phase",
      "label": "Review Phase",
      "description": "Review added documentation",
      "phase_ref": "review"
    },
    {
      "node_id": "node_review_001",
      "node_type": "review_gate",
      "label": "Documentation Review",
      "description": "Verify docstrings follow style guide and include examples",
      "review_criteria": [
        "All public functions have docstrings",
        "Docstrings follow Google style guide",
        "Examples included for complex functions"
      ]
    }
  ],
  "edges": [
    {
      "edge_id": "edge_001",
      "from_node": "node_phase_001",
      "to_node": "node_action_001",
      "edge_type": "sequential",
      "label": "start analysis"
    },
    {
      "edge_id": "edge_002",
      "from_node": "node_action_001",
      "to_node": "node_phase_002",
      "edge_type": "sequential",
      "label": "analysis complete"
    },
    {
      "edge_id": "edge_003",
      "from_node": "node_phase_002",
      "to_node": "node_action_002",
      "edge_type": "sequential",
      "label": "start implementation"
    },
    {
      "edge_id": "edge_004",
      "from_node": "node_action_002",
      "to_node": "node_phase_003",
      "edge_type": "sequential",
      "label": "implementation complete"
    },
    {
      "edge_id": "edge_005",
      "from_node": "node_phase_003",
      "to_node": "node_review_001",
      "edge_type": "sequential",
      "label": "ready for review"
    }
  ],
  "swimlanes": [
    {
      "swimlane_id": "swimlane_001",
      "agent_id": "documentation_agent",
      "role": "documenter",
      "node_refs": [
        "node_phase_001",
        "node_action_001",
        "node_phase_002",
        "node_action_002",
        "node_phase_003",
        "node_review_001"
      ]
    }
  ],
  "lineage": {
    "derived_from_intent": "intent_example_low_risk",
    "intent_checksum": "e87e081eaa352ae8c2196420609d47f985a30dd8f9439c9e760fb64720861701",
    "registry_versions": {
      "workflows": {
        "documentation_workflow": "1.0.0"
      },
      "agents": {
        "documentation_agent": "1.0.0"
      },
      "commands": {
        "scan_python_files": "1.0.0",
        "modify_python_file": "1.2.0"
      },
      "rules": {
        "require_evidence_for_write": "1.0.0"
      }
    },
    "coordinator_version": "0.9.2"
  },
  "checksum": "a1b2c3d4e5f6789012345678901234567890123456789012345678901234abcd",
  "metadata": {
    "execution_policy": "semi_auto",
    "estimated_duration": "15-20 minutes",
    "complexity_score": 25
  }
}
